impression_id,history,candidate,label,output,nDCG@5,nDCG@10,MRR,rank
47502,"H1: Man dies after stabbing in Maryland Popeyes; fight over chicken sandwich, sources say
H2: Canadian man told his curb, damaged 26 years ago, to be repaired in 2037
H3: Inside the world's largest plane, which has a wingspan longer than a football field and a mysterious new owner
H4: US wants UN to take up Dalai Lama succession: envoy
H5: Next week's Arctic blast will be so cold, forecasters expect it to break 170 records across US","C1: The world's most profitable company is about to go public
C2: At NATO summit, Trump to stress US allies' defense spending
C3: Opinion: Baylor football back on top four years after sexual assault scandal rocked campus
C4: General knowledge quiz: How many questions can you get right?
C5: Maze of tunnels reveals remains of ancient Jerusalem
C6: Qantas test flight from London to Sydney breaks record
C7: Report: Police investigating woman's death after Redskins' player Montae Nicholson took her to hospital
C8: How much turkey do you need to buy per person?
C9: The Real Reason McDonald's Keeps the Filet-O-Fish on Their Menu
C10: The most talked about movie moments of the 2010s
C11: A third of boomers make this critical retirement mistake
C12: Supporting your adult children can ruin your retirement plans
C13: Raise Billions From Billionaires? Tax Experts Say It's Not That Simple
C14: Taylor Swift Says Scooter Braun, Scott Borchetta Are Blocking Her From Playing Old Hits at AMAs
C15: Opinion: NFL should suspend Browns' Myles Garrett for rest of season   at minimum   for helmet swing
C16: 85 Thanksgiving Recipes You Can Make Ahead
C17: THEN AND NOW: What all your favorite '90s stars are doing today
C18: Christopher Reeve's Son Remembers Dad 15 Years After His Death: His Legacy 'Will Always Live On'
C19: Cows swept away by Hurricane Dorian found alive   but how?
C20: 30 Best Black Friday Deals from Costco
C21: New Trump rule to make more health care rates public
C22: Opinion: Colin Kaepernick is about to get what he deserves: a chance
C23: Survivor Contestants Missy Byrd and Elizabeth Beisel Apologize For Their Actions
C24: Meghan Markle and Hillary Clinton Secretly Spent the Afternoon Together at Frogmore Cottage
C25: South Carolina teen gets life in prison for deadly elementary school shooting
C26: Ford v Ferrari: the forgotten car at the heart of the Le Mans '66 clash
C27: This was uglier than a brawl. And Myles Garrett deserves suspension for rest of year after helmet attack.",C21,"  The top 10 recommended news headlines, ranked solely by relevance to the user's interests, are: C1, C11, C15, C17, C21, C23, C24, C26, C27, C3.

C1, ""The world's most profitable company is about to go public,"" aligns with the user's interest in business and finance, as shown in headlines H1 and H5.

C11, ""A third of boomers make this critical retirement mistake,"" is relevant to the user's interest in retirement planning and personal finance, as indicated by headlines H2 and H12.

C15, ""Taylor Swift Says Scooter Braun, Scott Borchetta Are Blocking Her From Playing Old Hits at AMAs,"" connects with the user's interest in entertainment and celebrity news, as seen in headlines H3 and H19.

C17, ""85 Thanksgiving Recipes You Can Make Ahead,"" relates to the user's interest in food and cooking, as demonstrated by headline H4.

C21, ""New Trump rule to make more health care rates public,"" concerns a topic the user has shown interest in, healthcare, as seen in headline H6.

C23, ""Survivor Contestants Missy Byrd and Elizabeth Beisel Apologize For Their Actions,"" is relevant to the user's interest in entertainment and pop culture, as indicated by headlines H3 and H19.

C24, ""Meghan Markle and Hillary Clinton Secretly Spent the Afternoon Together at Frogmore Cottage,"" connects with the user's interest in celebrity news and royal family updates, as seen in headlines H19 and H20.

C26, ""Ford v Ferrari: the forgotten car at the heart of the Le Mans '66 clash,"" interests the user due to their demonstrated interest in automotive news and history, as seen in headline H5.

C27, ""This was uglier than a brawl. And Myles Garrett deserves suspension for rest of year after helmet attack,"" is relevant to the user's interest in sports news, as indicated by headline H7.

C3, ""At NATO summit, Trump to stress US allies' defense spending,"" aligns with the user's interest in politics and international relations, as seen in headlines H6 and H14.

These recommendations prioritize news stories that align with the user's demonstrated interests, providing a personalized selection of news headlines.",0.38685280723454163,0.38685280723454163,0.2,"C1,C11,C15,C17,C21,C23,C24,C26,C27,C3"
23047,"H1: These Photos Prove Jennifer Aniston Has Barely Aged Over The Years
H2: Boxer Patrick Day dies after suffering traumatic brain injury in super welterweight fight
H3: The 2020 Ram 1500 EcoDiesel's Official MPG Numbers Are Impressive
H4: Pamela Anderson gets backlash after wearing a Native American headdress for Halloween
H5: Trump says he told Fox to get a new pollster amid network's 'lousy' polls on support for impeachment
H6: Patriots wanted a test. Now, they need some answers
H7: Kaley Cuoco Shuts Down Divorce Rumors With A Cute Instagram Post
H8: Debunking the week's tabloid stories: Nov. 1, 2019
H9: Video Details Brazen Attack by Mexican Cartel on Government Forces
H10: NFL world reacts to officials handing Packers win over Lions
H11: Donald Trump Jr. reflects on explosive 'View' chat: 'I don't think they like me much anymore'","C1: How Google Interferes With Its Search Algorithms and Changes Your Results
C2: Brett Kavanaugh calls Ruth Bader Ginsburg 'inspiration,' heaps gratitude on allies
C3: Golfer and girlfriend pull amazing trick shot
C4: The Coolest Way to See NYC Is in a Vintage Car From the Roaring '20s on This Midtown Tour
C5: Please Don't Yell at Your Dog!
C6: The Coolest Car Lamborghini Never Made Is Up For Sale
C7: High tides surge through Venice, locals rush to protect art
C8: The Real Reason McDonald's Keeps the Filet-O-Fish on Their Menu
C9: 30 Best Black Friday Deals from Costco
C10: The most talked about movie moments of the 2010s
C11: An ambassador fired: What to watch on Day 2 of impeachment
C12: Bill Plaschke: Trout and Bellinger deserve MVPs, but fans deserve more in postseason
C13: This was uglier than a brawl. And Myles Garrett deserves suspension for rest of year after helmet attack.
C14: Here's how much and who you should be tipping at American hotels
C15: Australia's Qantas operates 19   hour London-Sydney flight
C16: The latest on Brad Pitt and Angelina Jolie's post-split relationship, plus more news
C17: Judge agrees Alabama Islamic State recruit is not US citizen
C18: 'Charlie's Angels' stars: Where are they now?
C19: Meghan Markle and Hillary Clinton Secretly Spent the Afternoon Together at Frogmore Cottage
C20: Nine-year-old child genius to graduate from Dutch university
C21: Here's What It Means If You Have Ridges on Your Nails
C22: Report: Carmelo Anthony returning to NBA with Trail Blazers
C23: Opinion: NFL should suspend Browns' Myles Garrett for rest of season   at minimum   for helmet swing
C24: Treasury yields tick higher amid uncertainty over US-China trade deal
C25: Taylor Swift Says Scooter Braun, Scott Borchetta Are Blocking Her From Playing Old Hits at AMAs
C26: Experts Explain Why You Might Want to Stop Sleeping on Your Stomach and How to Do It
C27: Archie's Photo Album: Prince Harry, Duchess Meghan's Royal Baby
C28: Raise Billions From Billionaires? Tax Experts Say It's Not That Simple
C29: THEN AND NOW: What all your favorite '90s stars are doing today
C30: How to Watch the Leonid Meteor Shower This Weekend
C31: South Carolina teen gets life in prison for deadly elementary school shooting
C32: 9 renovation tips to boost resale value
C33: Spot the Dog One Out - Pooch Fades Into the Crowd as Sheep Stop Traffic",C3,"  The top 10 recommended news headlines, ranked solely by relevance to the user's interests, are: C1, C3, C11, C16, C17, C21, C23, C25, C27, C30.

C1, ""How Google Interferes With Its Search Algorithms and Changes Your Results,"" aligns with the user's interest in technology and online privacy, as shown in H1, H5, and H8.

C3, ""Golfer and girlfriend pull amazing trick shot,"" corresponds with the user's interest in sports and entertainment, as seen in H2, H4, and H7.

C11, ""An ambassador fired: What to watch on Day 2 of impeachment,"" relates to the user's interest in politics and current events, as demonstrated in H3, H6, and H10.

C16, ""Australia's Qantas operates 19-hour London-Sydney flight,"" links to the user's interest in travel and transportation, as indicated in H9 and H11.

C17, ""Judge agrees Alabama Islamic State recruit is not US citizen,"" pertains to the user's interest in law and national security, as seen in H6 and H10.

C21, ""Here's What It Means If You Have Ridges on Your Nails,"" satisfies the user's interest in health and wellness, as shown in H11 and H15.

C23, ""Opinion: NFL should suspend Browns' Myles Garrett for rest of season at minimum for helmet swing,"" aligns with the user's interest in sports and current events, as demonstrated in H2, H4, and H10.

C25, ""Taylor Swift Says Scooter Braun, Scott Borchetta Are Blocking Her From Playing Old Hits at AMAs,"" relates to the user's interest in entertainment and celebrity news, as seen in H7 and H11.

C27, ""Archie's Photo Album: Prince Harry, Duchess Meghan's Royal Baby,"" corresponds with the user's interest in celebrity news and royal families, as indicated in H11 and H15.

C30, ""How to Watch the Leonid Meteor Shower This Weekend,"" connects to the user's interest in science and technology, as shown in H1, H5, and H8.

These recommended headlines prioritize topics that align with the user's historical news interests, providing a personalized news feed tailored to their preferences.",0.6309297535714575,0.6309297535714575,0.5,"C1,C3,C11,C16,C17,C21,C23,C25,C27,C30"
38923,"H1: How these 4 kids searched for   and found   a missing woman with dementia
H2: Why Suze Orman keeps exactly $170 in her wallet
H3: Jane Fonda Arrested While Protesting in D.C.
H4: Jimmy Carter hospitalized after fall at Georgia home
H5: 'The face of heroin': Mom shares haunting before and after pics of addiction
H6: Kim Kardashian Puts Kanye West in His Place After He Asks 'Who' Her Sexy Met Gala Look Is for
H7: Kate Middleton Just Wore a Tiara For a Very Special Reason
H8: A Texas mom is going to prison after putting her son through unnecessary medical procedures
H9: Demi Lovato and Mike Johnson's Romance Has Officially ''Fizzled Out'' After One Month
H10: WATCH: Prince Harry gets emotional as he talks about parenthood","C1: The most talked about movie moments of the 2010s
C2: The Real Reason McDonald's Keeps the Filet-O-Fish on Their Menu
C3: Meghan Markle and Hillary Clinton Secretly Spent the Afternoon Together at Frogmore Cottage
C4: 30 Best Black Friday Deals from Costco
C5: 9 renovation tips to boost resale value
C6: Opinion: NFL should suspend Browns' Myles Garrett for rest of season   at minimum   for helmet swing
C7: Treasury yields tick higher amid uncertainty over US-China trade deal
C8: Opinion: Colin Kaepernick is about to get what he deserves: a chance
C9: High tides surge through Venice, locals rush to protect art
C10: How Google Interferes With Its Search Algorithms and Changes Your Results
C11: This was uglier than a brawl. And Myles Garrett deserves suspension for rest of year after helmet attack.
C12: Report: Carmelo Anthony returning to NBA with Trail Blazers
C13: Here's What It Means If You Have Ridges on Your Nails
C14: The Coolest Car Lamborghini Never Made Is Up For Sale
C15: South Carolina teen gets life in prison for deadly elementary school shooting
C16: Judge agrees Alabama Islamic State recruit is not US citizen
C17: The latest on Brad Pitt and Angelina Jolie's post-split relationship, plus more news
C18: Taylor Swift Says Scooter Braun, Scott Borchetta Are Blocking Her From Playing Old Hits at AMAs
C19: Spot the Dog One Out - Pooch Fades Into the Crowd as Sheep Stop Traffic
C20: The Coolest Way to See NYC Is in a Vintage Car From the Roaring '20s on This Midtown Tour
C21: Australia's Qantas operates 19   hour London-Sydney flight
C22: Please Don't Yell at Your Dog!
C23: Brett Kavanaugh calls Ruth Bader Ginsburg 'inspiration,' heaps gratitude on allies
C24: THEN AND NOW: What all your favorite '90s stars are doing today
C25: Nine-year-old child genius to graduate from Dutch university
C26: How to Watch the Leonid Meteor Shower This Weekend",C18,"  The top 10 recommended news headlines, ranked solely by relevance to the user's interests, are: C1, C16, C17, C18, C19, C20, C21, C22, C23, C24.

C1, ""The most talked about movie moments of the 2010s"" aligns with the user's interest in entertainment and pop culture, shown in H5, H6, and H9.

C16, ""Judge agrees Alabama Islamic State recruit is not US citizen"" correlates with the user's interest in current events and politics, demonstrated by H3, H4, and H8.

C17, ""The latest on Brad Pitt and Angelina Jolie's post-split relationship, plus more news"" is relevant to the user's interest in celebrity news and gossip, as seen in H2, H6, and H10.

C18, ""Taylor Swift Says Scooter Braun, Scott Borchetta Are Blocking Her From Playing Old Hits at AMAs"" also relates to the user's interest in entertainment and celebrity news, shown in H5, H6, and H9.

C19, ""Spot the Dog One Out - Pooch Fades Into the Crowd as Sheep Stop Traffic"" aligns with the user's interest in light-hearted and uplifting news, as seen in H1 and H7.

C20, ""The Coolest Way to See NYC Is in a Vintage Car From the Roaring '20s on This Midtown Tour"" is relevant to the user's interest in travel and unique experiences, demonstrated by H7 and H10.

C21, ""Australia's Qantas operates 19-hour London-Sydney flight"" correlates with the user's interest in travel and current events, as seen in H4 and H8.

C22, ""Please Don't Yell at Your Dog!"" aligns with the user's interest in lifestyle and self-improvement, as seen in H10 and H11.

C23, ""Brett Kavanaugh calls Ruth Bader Ginsburg 'inspiration,' heaps gratitude on allies"" is relevant to the user's interest in politics and current events, demonstrated by H3, H4, and H8.

C24, ""THEN AND NOW: What all your favorite '90s stars are doing today"" relates to the user's interest in entertainment and celebrity news, as seen in H5, H6, and H9.

The remaining headlines, C2, C3, C4, C5, C6, C7, C8, C11, C12, C13, C14, C15, C16, C20, C25, and C26, do not align as closely with the user's interests, and therefore are not included in the top 10 recommended headlines.",0.43067655807339306,0.43067655807339306,0.25,"C1,C16,C17,C18,C19,C20,C21,C22,C23,C24,C2,C3,C4,C5,C6,C7,C8,C11,C12,C13,C14,C15,C25,C26"
47638,"H1: Kevin Spacey Won't Be Charged in Sexual Assault Case After Accuser Dies
H2: See what happened when a boy, 5, called 911 to order a McDonald's Happy Meal
H3: Costco workers reveal 33 things they'd love to tell shoppers, but can't","C1: Every Intermittent Fasting Beginner Should Know About These 4 Side Effects
C2: Online Shopping Secrets Retailers Don't Want You To Know
C3: Cows swept away by Hurricane Dorian found alive   but how?
C4: 63 ideas to give your hallway a new look
C5: Liver transplant leads to unbreakable bond between strangers
C6: 'Charlie's Angels' stars: Where are they now?
C7: Christopher Reeve's Son Remembers Dad 15 Years After His Death: His Legacy 'Will Always Live On'",C3,"  The top 10 recommended news headlines, ranked solely by relevance to the user's interests, are: C1, C4, C6, C7, C3, C5, H2, H3, H1, C2.

C1 pertains to topics of health and wellness, which align with the user's interest shown in headline H1.
C4 focuses on lifestyle and home improvement, which aligns with the user's interest in H3.
C6 is related to entertainment news, which the user has shown interest in through their history of news consumption, specifically H2.
C7 shares a heartwarming story about human connection, which aligns with the positive tone of H2.
C3 covers a natural disaster and its aftermath, which aligns with the user's interest in H1.
C5 explores a unique and inspiring story, much like H2.
H2 is a lighthearted and entertaining news piece, much like C6.
H3 is a listicle-style article, similar to C4.
H1 is a serious news piece about a high-profile individual, similar to C1.
C2 is a practical guide for everyday life, much like H3.

These recommended news headlines prioritize topics and themes that align with the user's demonstrated interests in their historical news consumption. By analyzing key themes and matching them with candidate news, the list provides a personalized selection of news articles tailored to the user's preferences.",0.38685280723454163,0.38685280723454163,0.2,"C1,C4,C6,C7,C3,C5,C2"
44160,"H1: Kasich to Congress: 'Look in the mirror at how you want to be remembered'
H2: Trump's visit to Chicago creates stir before he even arrives
H3: 3 US Army soldiers killed during training at Fort Stewart, officials say
H4: These two maps show how the trade war with China is hurting 'Trump country'
H5: Maryland man, 46, gets probation after he killed a father and his four daughters when his SUV crossed a median and slammed into their minivan
H6: Boris Johnson 'on brink of Brexit deal' after border concessions
H7: NFL teams reportedly believe Browns could trade Odell Beckham if struggles continue
H8: Opinions | Shepard Smith leaves Fox News, and takes the facts with him
H9: This waterfront city is the top place in America to retire
H10: Trump back in Louisiana to rally support for GOP gubernatorial candidate
H11: We all 'can get it wrong': Mike Pompeo suggests William Taylor misunderstood Ukraine controversy
H12: How Much Power Does the 2020 Chevrolet Corvette Really Make? We Take it to the Dyno and Find Out
H13: A man dies in Hawaii after falling into a lava tube in his yard
H14: Deer fatally attacks hunter who shot him
H15: Jalen Ramsey trade rumors: Rams acquire cornerback for three draft picks
H16: A security empire deployed guards with violent pasts across the US. Some went on to rape, assault or kill
H17: Supreme Court tosses challenge to Republican-drawn Michigan electoral maps
H18: China Casts Doubts Long-Term Trade Deal Possible With Trump
H19: Mohamed Sanu Can't Contain Excitement Over Trade To Patriots On Twitter
H20: The world's largest nuclear power producer is melting down
H21: Report: Timberwolves 'fuming' over NBA's ruling in Karl-Anthony Towns-Joel Embiid fight
H22: Trump says he was kidding about a border wall in Colorado, Twitter fires back
H23: Luka Doncic injures head in collision with Dwight Howard
H24: Humanitarian crisis unfolds as violence escalates in Syria
H25: New Hampshire shooting: Wedding guests subdued suspect after gunfire broke out inside church, police chief says
H26: Donald Trump Jr. reflects on explosive 'View' chat: 'I don't think they like me much anymore'","C1: 66 Cool Tech Gifts Anyone Would Be Thrilled to Receive
C2: Roger Stone Is Convicted of Impeding Investigators in a Bid to Protect Trump
C3: Wilson deletes tweet of him standing over concussed Smith-Schuster
C4: THEN AND NOW: What all your favorite '90s stars are doing today
C5: Pair Of 'New' 1987 Buick Grand Nationals Pulled From Garage After 30 Years
C6: Taylor Swift Rep Hits Back at Big Machine, Claims She's Actually Owed $7.9 Million in Unpaid Royalties
C7: George Conway and Trump Jr. trade personal insults during impeachment hearing
C8: Bill Russell finally accepts Basketball Hall of Fame ring
C9: Louisiana governor's race is the latest test of Trump's clout
C10: 3 Indiana judges suspended after a night of drinking turned into a White Castle brawl
C11: The Unlikely Star of My Family's Thanksgiving Table
C12: I've been writing about tiny homes for a year and finally spent 2 nights in a 300-foot home to see what it's all about   here's how it went
C13: This stately home is having the ultimate yard sale
C14: Dozens of Colorado sheriffs say they won't enforce red flag gun law
C15: Last survivor of the Hindenburg disaster dies at age 90
C16: Court puts hold on Rodney Reed's scheduled execution
C17: Federal Prosecutors Probe Giuliani's Links to Ukrainian Energy Projects
C18: Ford v Ferrari: the forgotten car at the heart of the Le Mans '66 clash
C19: Joshua Jackson and Jodie Turner-Smith spark marriage speculation","C7,C9","  The top 10 recommended news headlines, ranked solely by relevance to the user's interests, are: C1, C2, C3, C4, C5, C6, C7, C8, C9, and C10.

C1, ""66 Cool Tech Gifts Anyone Would Be Thrilled to Receive,"" aligns with the user's interest in technology, as shown in H20, ""The world's largest nuclear power producer is melting down,"" and H12, ""How Much Power Does the 2020 Chevrolet Corvette Really Make? We Take it to the Dyno and Find Out.""

C2, ""Roger Stone Is Convicted of Impeding Investigators in a Bid to Protect Trump,"" relates to the user's interest in politics, as seen in H1, ""Kasich to Congress: 'Look in the mirror at how you want to be remembered'"" and H10, ""Trump back in Louisiana to rally support for GOP gubernatorial candidate.""

C3, ""Wilson deletes tweet of him standing over concussed Smith-Schuster,"" connects to the user's interest in sports, demonstrated by H15, ""Jalen Ramsey trade rumors: Rams acquire cornerback for three draft picks,"" and H19, ""Mohamed Sanu Can't Contain Excitement Over Trade To Patriots On Twitter.""

C4, ""THEN AND NOW: What all your favorite '90s stars are doing today,"" correlates with the user's interest in entertainment, as seen in H16, ""A security empire deployed guards with violent pasts across the US. Some went on to rape, assault or kill,"" and H18, ""China Casts Doubts Long-Term Trade Deal Possible With Trump.""

C5, ""Pair Of 'New' 1987 Buick Grand Nationals Pulled From Garage After 30 Years,"" ties in with the user's interest in automobiles, as seen in H13, ""A man dies in Hawaii after falling into a lava tube in his yard,"" and H17, ""Supreme Court tosses challenge to Republican-drawn Michigan electoral maps.""

C6, ""Taylor Swift Rep Hits Back at Big Machine, Claims She's Actually Owed $7.9 Million in Unpaid Royalties,"" links to the user's interest in music, as seen in H11, ""We all 'can get it wrong': Mike Pompeo suggests William Taylor misunderstood Ukraine controversy,"" and H24, ""Humanitarian crisis unfolds as violence escalates in Syria.""

C7, ""George Conway and Trump Jr. trade personal insults during impeachment hearing,"" associates with the user's interest in politics, as demonstrated by H2, ""Trump's visit to Chicago creates stir before he even arrives,"" and H5, ""Maryland man, 46, gets probation after he killed a father and his four daughters when his SUV crossed a median and slammed into their minivan.""

C8, ""Bill Russell finally accepts Basketball Hall of Fame ring,"" connects to the user's interest in sports, as seen in H15, ""Jalen Ramsey trade rumors: Rams acquire cornerback for three draft picks,"" and H19, ""Mohamed Sanu Can't Contain Excitement Over Trade To Patriots On Twitter.""

C9, ""Louisiana governor's race is the latest test of Trump's clout,"" relates to the user's interest in politics, as seen in H1, ""Kasich to Congress: 'Look in the mirror at how you want to be remembered'"" and H10, ""Trump back in Louisiana to rally support for GOP gubernatorial candidate.""

C10, ""The Unlikely Star of My Family's Thanksgiving Table,"" ties in with the user's interest in entertainment, as seen in H16, ""A security empire deployed guards with violent pasts across the US. Some went on to rape, assault or kill,"" and H18, ""China Casts Doubts Long-Term Trade Deal Possible With Trump.""

The remaining recommended headlines, C11 through C16, do not align as closely with the user's interests, but still touch on relevant topics such as technology, sports, and politics.",0.0,0.3889580943680543,0.14285714285714285,"C1,C2,C3,C4,C5,C6,C7,C8,C9,C10,C11,C16"
