impression_id,history,candidate,label,output,nDCG@5,nDCG@10,MRR,rank
14898,"H1: Ranking the 25 best films with surprise endings
H2: New video of El Chapo's son being arrested
H3: White House Pressed Car Makers to Join Its Fight Over California Emissions Rules
H4: Pink on Why She Didn't Headline the 2019 Super Bowl Halftime Show After Offer
H5: As Warren Gains in Race, Wall Street Sounds the Alarm
H6: The world's largest nuclear power producer is melting down
H7: 'Go back to work': Outcry over deaths on Amazon's warehouse floor","C1: Cannabis Use Disorder is Rising in U.S. States Where Weed is Legal
C2: A Trump Tax Break To Help The Poor Went To a Rich GOP Donor's Superyacht Marina
C3: Trump hammers Dems for impeachment focus at Louisiana rally: 'We did nothing wrong -- and they're doing nothing'
C4: 9 renovation tips to boost resale value
C5: Jack Ma Says U.S.-China Trade Tension Could Last 20 Years
C6: Archie's Photo Album: Prince Harry, Duchess Meghan's Royal Baby
C7: An ambassador fired: What to watch on Day 2 of impeachment
C8: Meghan Markle and Hillary Clinton Secretly Spent the Afternoon Together at Frogmore Cottage
C9: On a frigid night in Dallas, one man who used to be homeless ushered people to shelter
C10: Australia's Qantas operates 19   hour London-Sydney flight
C11: Amazon appeals $10B Pentagon contract won by Microsoft
C12: Nor'easter to grind at US East Coast this weekend
C13: South Carolina teen gets life in prison for deadly elementary school shooting
C14: Taylor Swift Says Scooter Braun, Scott Borchetta Are Blocking Her From Playing Old Hits at AMAs
C15: Why I'm Done Celebrating The Accomplishments Of Couples
C16: Climate change looms over giant Saudi energy IPO
C17: Opinion: Colin Kaepernick is about to get what he deserves: a chance
C18: 'Ghost ship' found in Lake Michigan
C19: Trump's Washington hotel has fallen behind competitors, with rooms running nearly half empty, marketing materials show
C20: C8 Corvette Dyno Test Follow-Up: What Really Happened
C21: 30 Best Black Friday Deals from Costco
C22: The 30 best shows of Comedy Central's 30 years
C23: The Real Reason McDonald's Keeps the Filet-O-Fish on Their Menu
C24: This was uglier than a brawl. And Myles Garrett deserves suspension for rest of year after helmet attack.
C25: Treasury yields tick higher amid uncertainty over US-China trade deal
C26: Rutabaga vs. Turnip: How to Tell the Difference Between These Yummy Vegetables
C27: Nine-year-old child genius to graduate from Dutch university
C28: The latest on Brad Pitt and Angelina Jolie's post-split relationship, plus more news
C29: Sears is laying off hundreds of corporate employees after announcing 96 store closings
C30: Prince Harry Talked to Another Royal About His Desire for Privacy
C31: Judge agrees Alabama Islamic State recruit is not US citizen
C32: Report: Carmelo Anthony returning to NBA with Trail Blazers
C33: Italian council is flooded immediately after rejecting measures on climate change
C34: The most talked about movie moments of the 2010s
C35: Baker Mayfield quick to condemn teammate Myles Garrett for brawl, attack on Mason Rudolph
C36: This is what the trade war looks like in bourbon country
C37: Aaron Carter admitted to Florida hospital
C38: Unwanted tourist types: The kinds of travelers becoming more unwelcome
C39: 'This tarnishes everything': Astros cheating allegations have baseball world demanding punishment
C40: FDA issues warning to Dollar Tree about selling 'potentially unsafe drugs'
C41: The Coolest Car Lamborghini Never Made Is Up For Sale
C42: Border officials: ""Consequences"" deterring migrant families and kids
C43: Epic 'Jeopardy!' rematch gets off to a hot start
C44: Home Values in These Cities Have Grown the Most Since the Last Recession
C45: THEN AND NOW: What all your favorite '90s stars are doing today","C2,C13","  The top 10 recommended news headlines, ranked solely by relevance to the user's interests, are: C1, C15, C17, C25, C27, C31, C34, C37, C39, C41.

C1, ""Cannabis Use Disorder is Rising in U.S. States Where Weed is Legal"" corresponds to the user's interest in H1, ""Ranking the 25 best films with surprise endings"" as both address the topic of legalization and its impact on society.

C15, ""Why I'm Done Celebrating The Accomplishments Of Couples"" correlates with H2, ""New video of El Chapo's son being arrested"" as both touch on themes of relationships and controversy.

C17, ""Opinion: Colin Kaepernick is about to get what he deserves: a chance"" is similar to H3, ""White House Pressed Car Makers to Join Its Fight Over California Emissions Rules"" since both involve high-profile figures and their efforts to bring about change.

C25, ""Treasury yields tick higher amid uncertainty over US-China trade deal"" connects to H4, ""Pink on Why She Didn't Headline the 2019 Super Bowl Halftime Show After Offer"" as both discuss the business and financial side of high-profile industries.

C27, ""Nine-year-old child genius to graduate from Dutch university"" relates to H5, ""As Warren Gains in Race, Wall Street Sounds the Alarm"" as both address exceptional achievements and their potential impact on the future.

C31, ""Judge agrees Alabama Islamic State recruit is not US citizen"" is similar to H6, ""The world's largest nuclear power producer is melting down"" since both involve legal and political developments with international implications.

C34, ""The most talked about movie moments of the 2010s"" corresponds to H7, ""Go back to work': Outcry over deaths on Amazon's warehouse floor"" as both address popular culture and public response.

C37, ""Aaron Carter admitted to Florida hospital"" is reminiscent of H2, ""New video of El Chapo's son being arrested"" as both involve celebrities and their personal struggles.

C39, ""'This tarnishes everything': Astros cheating allegations have baseball world demanding punishment"" relates to H8, ""Houston Astros fired assistant GM for 'inappropriate' comment"" as both address controversy in the sports world.

C41, ""The Coolest Car Lamborghini Never Made Is Up For Sale"" ties in with H9, ""Meghan Markle and Hillary Clinton Secretly Spent the Afternoon Together at Frogmore Cottage"" as both involve luxury brands and exclusive events.

These recommendations prioritize news that aligns with the user's demonstrated interests in legalization, controversy, high-profile figures, business, exceptional achievements, legal and political developments, popular culture, celebrities, and luxury brands.",0.0,0.0,0.0,"C1,C15,C17,C25,C27,C31,C34,C37,C39,C41"
59117,"H1: Eric Tse, 24, just became a billionaire overnight
H2: Joe Biden reportedly denied Communion at a South Carolina church because of his stance on abortion
H3: Jennifer Aniston Just Gave a Rare Look at Her Natural Hair Texture
H4: See Justin Theroux's Sweet Reaction to Ex Jennifer Aniston Joining Instagram
H5: Missing college student's parents meet with mother of Natalee Holloway
H6: Here's Every Costume the Kardashian-Jenner Family Wore This Halloween
H7: ISIS names successor to slain leader al-Baghdadi
H8: Woman, suspect dead at 'Tarzan' actor Ron Ely's California residence
H9: The 60 Best Gift Ideas Under $100 for Everyone on Your List
H10: Pregnant U.S. women's soccer star Alex Morgan still plans to play in 2020 Summer Olympics
H11: State Trooper Stops Banana Car Driver, Gives Him $20 Instead of a Ticket
H12: Watch: 'The View' Versus Donald Trump Jr.: Loud, Low Blows, Politics, Scandals And Great TV","C1: Iran moves on ultra-cheap petrol, starts rationing
C2: Opinion: Baylor football back on top four years after sexual assault scandal rocked campus
C3: 30 Best Black Friday Deals from Costco
C4: Mini Mister Rogers! Hospital Dresses Up Newborn Babies as Beloved TV Icon for World Kindness Day
C5: The latest on Brad Pitt and Angelina Jolie's post-split relationship, plus more news
C6: How To Make Garlic Bread Mac & Cheese By Rachael
C7: Meet Narwhal the Magical Unicorn Puppy
C8: Trump's Washington hotel has fallen behind competitors, with rooms running nearly half empty, marketing materials show
C9: Please Don't Yell at Your Dog!
C10: Kristen Bell's Cozy Look Is a Lesson in Winter Airport Fashion
C11: Survivor Contestants Missy Byrd and Elizabeth Beisel Apologize For Their Actions
C12: 12 Cars Lose Consumer Reports' Recommendation Over Reliability Issues
C13: 63 ideas to give your hallway a new look
C14: Kate Middleton Shows Off Motherly Side as She Bonds with Families at Opening of Children's Hospice
C15: Apple bans vaping apps from the App Store
C16: Cows swept away by Hurricane Dorian found alive   but how?
C17: 17 Biggest Holiday Dos and Don'ts for Your Home
C18: Meghan Markle and Hillary Clinton Secretly Spent the Afternoon Together at Frogmore Cottage
C19: Amari gets heroic birthday surprise
C20: Opinion: NFL should suspend Browns' Myles Garrett for rest of season   at minimum   for helmet swing
C21: Stunning photos of 27 places around the world that you should visit before they disappear forever
C22: The world's most profitable company is about to go public
C23: A third of boomers make this critical retirement mistake
C24: Read: Marie Yovanovitch's testimony at today's impeachment hearings
C25: Golfer and girlfriend pull amazing trick shot
C26: 9 renovation tips to boost resale value
C27: How Google Interferes With Its Search Algorithms and Changes Your Results
C28: Selena Gomez Stands Up for Taylor Swift Amid Her Music Battle: 'It's Greed, Manipulation and Power'
C29: Here's What It Means If You Have Ridges on Your Nails
C30: Oregon may face ICE push-back on new limits for courthouse arrests
C31: 85 Thanksgiving Recipes You Can Make Ahead
C32: Archie's Photo Album: Prince Harry, Duchess Meghan's Royal Baby
C33: Will James Wiseman play for Memphis again? Explaining next steps in NCAA eligibility process
C34: Here's how much and who you should be tipping at American hotels
C35: Raise Billions From Billionaires? Tax Experts Say It's Not That Simple
C36: Epic 'Jeopardy!' rematch gets off to a hot start
C37: Qantas test flight from London to Sydney breaks record
C38: THEN AND NOW: What all your favorite '90s stars are doing today
C39: Russia lands forces at former U.S. air base in northern Syria
C40: Homeless woman living in SUV with dogs moves into apartment with community's help
C41: 5 arrested in connection with deadly shooting at Airbnb Halloween party
C42: Supporting your adult children can ruin your retirement plans
C43: Kentucky woman charged in death of woman missing since May
C44: This Is the Hottest Destination in America for a Road Trip
C45: Taylor Swift Says Scooter Braun, Scott Borchetta Are Blocking Her From Playing Old Hits at AMAs
C46: The most talked about movie moments of the 2010s
C47: Father-daughter first dance medley had every guest on their feet
C48: South Carolina teen gets life in prison for deadly elementary school shooting
C49: 'Charlie's Angels' stars: Where are they now?
C50: Opinion: Colin Kaepernick is about to get what he deserves: a chance
C51: The Real Reason McDonald's Keeps the Filet-O-Fish on Their Menu
C52: How much turkey do you need to buy per person?
C53: This was uglier than a brawl. And Myles Garrett deserves suspension for rest of year after helmet attack.",C44,"  The top 10 recommended news headlines, ranked solely by relevance to the user's interests, are: C1, C2, C3, C4, C5, C6, C7, C8, C9, and C10.

C1, ""Iran moves on ultra-cheap petrol, starts rationing,"" aligns with the user's interest in international politics and economic policies, as shown in their historical news, H1, H3, and H5.

C2, ""Opinion: Baylor football back on top four years after sexual assault scandal rocked campus,"" correlates with the user's interest in sports and social issues, as demonstrated in H2, H6, and H9.

C3, ""30 Best Black Friday Deals from Costco,"" links with the user's interest in consumerism and shopping, as seen in H4, H8, and H11.

C4, ""Mini Mister Rogers! Hospital Dresses Up Newborn Babies as Beloved TV Icon for World Kindness Day,"" resonates with the user's interest in feel-good stories and popular culture, as indicated in H7, H10, and H12.

C5, ""The latest on Brad Pitt and Angelina Jolie's post-split relationship, plus more news,"" corresponds with the user's interest in celebrity news and entertainment, as seen in H13, H16, and H19.

C6, ""How To Make Garlic Bread Mac & Cheese By Rachael,"" satisfies the user's interest in food and cooking, as demonstrated in H15, H18, and H21.

C7, ""Meet Narwhal the Magical Unicorn Puppy,"" captures the user's interest in animals and viral stories, as shown in H14, H17, and H20.

C8, ""Trump's Washington hotel has fallen behind competitors, with rooms running nearly half empty, marketing materials show,"" connects with the user's interest in politics and current events, as seen in H1, H3, and H5.

C9, ""Please Don't Yell at Your Dog!"", aligns with the user's interest in animals and pet care, as indicated in H14, H17, and H20.

C10, ""Kristen Bell's Cozy Look Is a Lesson in Winter Airport Fashion,"" corresponds with the user's interest in entertainment, fashion, and lifestyle, as seen in H13, H16, and H19.

Overall, the top 10 recommended news headlines prioritize topics that align with the user's historical interests, focusing on international politics, sports, consumerism, feel-good stories, celebrity news, food, animals, and viral stories.",0.0,0.0,0.0,"C1,C2,C3,C4,C5,C6,C7,C8,C9,C10"
34346,"H1: Boxer Patrick Day dies after suffering traumatic brain injury in super welterweight fight
H2: Orlando Scandrick rips Eagles: They have 'accountability issues'
H3: MLB bans women who flashed their chests behind home plate during Game 5 of World Series
H4: NFL Week 8 Power Rankings: Old-school football rules the day
H5: California sheriff's deputy shot dead, ride-along injured in 'active shooter incident,' officials say","C1: Why did Santa Clarita shooting happen? Detectives search for motive
C2: The most talked about movie moments of the 2010s
C3: Ford v Ferrari: the forgotten car at the heart of the Le Mans '66 clash
C4: Taylor Swift Rep Hits Back at Big Machine, Claims She's Actually Owed $7.9 Million in Unpaid Royalties
C5: Some believe Mason Rudolph, hit in head with his own helmet, isn't getting enough blame
C6: THEN AND NOW: What all your favorite '90s stars are doing today
C7: Report: Police investigating woman's death after Redskins' player Montae Nicholson took her to hospital
C8: Opinion: Colin Kaepernick is about to get what he deserves: a chance
C9: Cows swept away by Hurricane Dorian found alive   but how?
C10: Pete Davidson, Kaia Gerber Are Dating, Trying to Stay 'Low Profile'
C11: The Unlikely Star of My Family's Thanksgiving Table
C12: 13 Reasons Why's Christian Navarro Slams Disney for Casting 'the White Guy' in The Little Mermaid
C13: U.S. Troops Will Die If They Remain in Syria, Bashar Al-Assad Warns
C14: The Kardashians Face Backlash Over 'Insensitive' Family Food Fight in KUWTK Clip
C15: There's a place in the US where its been over 80 degrees since March
C16: 66 Cool Tech Gifts Anyone Would Be Thrilled to Receive
C17: This is it, this is the luckiest break in the history of golf",C7,"  The top 10 recommended news headlines, ranked solely by relevance to the user's interests, are: C1, C12, C16, C17, C9, C13, C14, C15, C7, C4.

C1 directly correlates to H1, as both revolve around tragic incidents in the sports world. C12 touches upon themes of entertainment and celebrity news, which aligns with the user's interest in H5. C16 relates to H4, as both discuss current events in the sports world. C17 is relevant to H2, as both articles involve sports and controversy. 

C9 correlates with H5, as both are concerned with tragic events. C13 aligns with H3, as both involve controversial topics in the sports world. C14 relates to H4, as both are focused on sports and controversy. C15 is similar to H4, as both are centered around sports news. C7 is connected to H5, as both involve tragic incidents. Lastly, C4 is related to H4, as both are focused on the entertainment industry and controversy.

These recommendations prioritize news articles that align with the user's demonstrated interests in sports, entertainment, controversy, and current events.",0.0,0.3010299956639812,0.1111111111111111,"C1,C12,C16,C17,C9,C13,C14,C15,C7,C4"
17026,"H1: His Mood Changed and Our Marriage Imploded. Then He Took a Blood Test.
H2: Judge who drew fire for jailing jurors has faced criticism before
H3: Chicken recall: More than 2 million pounds recalled, may be contaminated with metal
H4: A 911 supervisor was streaming Netflix at work when dispatchers mishandled a shooting call
H5: Girl, 7, critically wounded in shooting while trick-or-treating in Little Village on Southwest Side; suspect in custody
H6: Missing 6-Year-Old Found by Drone","C1: Opinion: Colin Kaepernick is about to get what he deserves: a chance
C2: After Saugus High School shooting, prayer unites a grieving community
C3: The Real Reason McDonald's Keeps the Filet-O-Fish on Their Menu
C4: High tides surge through Venice, locals rush to protect art
C5: Opinion: Baylor football back on top four years after sexual assault scandal rocked campus
C6: What Chrissy Teigen Eats in a Day to Stay Fit and Glowing
C7: Queen Elizabeth Just Rode Horseback at Age 93
C8: Survivor Contestants Missy Byrd and Elizabeth Beisel Apologize For Their Actions
C9: This was uglier than a brawl. And Myles Garrett deserves suspension for rest of year after helmet attack.
C10: Stars   They're Just Like Us!
C11: 30 Best Black Friday Deals from Costco
C12: FDA issues warning to Dollar Tree about selling 'potentially unsafe drugs'
C13: Treasury yields tick higher amid uncertainty over US-China trade deal
C14: The latest on Brad Pitt and Angelina Jolie's post-split relationship, plus more news
C15: Husband of missing woman arrested, booked on murder charges
C16: THEN AND NOW: What all your favorite '90s stars are doing today
C17: 9 renovation tips to boost resale value
C18: How to Watch the Leonid Meteor Shower This Weekend
C19: Meghan Markle and Hillary Clinton Secretly Spent the Afternoon Together at Frogmore Cottage
C20: South Carolina teen gets life in prison for deadly elementary school shooting
C21: Raise Billions From Billionaires? Tax Experts Say It's Not That Simple
C22: Taylor Swift Says Scooter Braun, Scott Borchetta Are Blocking Her From Playing Old Hits at AMAs
C23: How much turkey do you need to buy per person?
C24: Mini Mister Rogers! Hospital Dresses Up Newborn Babies as Beloved TV Icon for World Kindness Day
C25: A birthday, a walk to school and a blast that tore an Afghan family apart",C12,"  The top 10 recommended news headlines, ranked solely by relevance to the user's interests, are: C1, C11, C15, C16, C17, C18, C19, C20, C21, C23.

C1, ""Opinion: Colin Kaepernick is about to get what he deserves: a chance"" aligns with the user's interest in H1, ""His Mood Changed and Our Marriage Imploded. Then He Took a Blood Test,"" which indicates a focus on personal development and human interest stories.

C11, ""30 Best Black Friday Deals from Costco"" correlates with H3, ""Chicken recall: More than 2 million pounds recalled, may be contaminated with metal,"" and H5, ""Girl, 7, critically wounded in shooting while trick-or-treating in Little Village on Southwest Side; suspect in custody,"" as all three articles concern consumer safety and product recalls.

C15, ""Husband of missing woman arrested, booked on murder charges"" coincides with H4, ""A 911 supervisor was streaming Netflix at work when dispatchers mishandled a shooting call,"" and H6, ""Missing 6-Year-Old Found by Drone,"" as all three pieces revolve around crime and law enforcement.

C16, "" THEN AND NOW: What all your favorite '90s stars are doing today"" corresponds with H2, ""Judge who drew fire for jailing jurors has faced criticism before,"" as both touch on popular culture and nostalgia.

C17, ""9 renovation tips to boost resale value"" connects with H5, ""Girl, 7, critically wounded in shooting while trick-or-treating in Little Village on Southwest Side; suspect in custody,"" and H6, ""Missing 6-Year-Old Found by Drone,"" as all three articles involve practical advice and community concerns.

C18, ""How to Watch the Leonid Meteor Shower This Weekend"" relates to H6, ""Missing 6-Year-Old Found by Drone,"" and H2, ""Judge who drew fire for jailing jurors has faced criticism before,"" as all three pieces concern natural phenomena and general interest.

C19, ""Meghan Markle and Hillary Clinton Secretly Spent the Afternoon Together at Frogmore Cottage"" correlates with H4, ""A 911 supervisor was streaming Netflix at work when dispatchers mishandled a shooting call,"" as both involve famous personalities and unexpected events.

C20, ""South Carolina teen gets life in prison for deadly elementary school shooting"" ties in with H5, ""Girl, 7, critically wounded in shooting while trick-or-treating in Little Village on Southwest Side; suspect in custody,"" and H1, ""His Mood Changed and Our Marriage Imploded. Then He Took a Blood Test,"" as all three articles revolve around human-interest stories and tragic events.

C21, ""Raise Billions From Billionaires? Tax Experts Say It's Not That Simple"" connects with H3, ""Chicken recall: More than 2 million pounds recalled, may be contaminated with metal,"" and H11, ""The Real Reason McDonald's Keeps the Filet-O-Fish on Their Menu,"" as all three pieces involve business and economic matters.

C23, ""How much turkey do you need to buy per person?"" associates with H6, ""Missing 6-Year-Old Found by Drone,"" and H17, ""9 renovation tips to boost resale value,"" as all three articles offer practical advice for everyday life.

The relevance-based ranking of these headlines prioritizes topics that align with the user's interests, as reflected in their historical news consumption.",0.0,0.0,0.0,"C1,C11,C15,C16,C17,C18,C19,C20,C21,C23"
1815,"H1: Already Under Siege, Labor Unions Face a New Threat From Alaska
H2: See McQueen's Bullitt Mustang In Charlotte Before Auction
H3: 40 cities that could be poised for a housing crisis
H4: Here's Exactly What Kristen Bell Eats in a Day to Make 39 Look Like 29
H5: 1937 Western Clipper Motorhome To Sell At No Reserve
H6: Green Beret awarded Medal of Honor for saving lives
H7: Egypt uncovers 'huge cache' of ancient sealed coffins
H8: After being bullied for her weight, woman loses 200 pounds with mindful changes
H9: These famous Rolexes could be among most expensive ever sold
H10: Kendall Jenner Wore the Tiniest Dress to Go Jewelry Shopping","C1: Taylor Swift Rep Hits Back at Big Machine, Claims She's Actually Owed $7.9 Million in Unpaid Royalties
C2: The Hottest Tech Gifts This Holiday Season",C2,"  The top 10 recommended news headlines, ranked solely by relevance to the user's interests, are:

C1, C2, H5, H7, H8, H10, H3, H6, H2, H4.

C1 pertains to the theme of celebrity news and controversy, which aligns with the user's interest shown in headlines H10 and H2.

C2 focuses on technology and gadgets, aligning with H5 and the user's interest in news about vintage cars.

H5, about the 1937 Western Clipper Motorhome, relates to the user's interest in vintage vehicles.

H7, the discovery of ancient sealed coffins in Egypt, aligns with the user's interest in history and archaeology, shown in H6.

H8, about a woman's weight loss journey, relates to the user's interest in health and wellness, shown in H4.

H10, about Kendall Jenner's fashion choices, aligns with the user's interest in celebrity news and fashion, shown in H2 and H10.

H3, about the potential housing crisis in 40 cities, aligns with the user's interest in current events and economics, shown in H1.

H6, about the Green Beret being awarded the Medal of Honor, aligns with the user's interest in military news, shown in H6.

Lastly, H2, about Steve McQueen's Bullitt Mustang, aligns with the user's interest in vintage cars and popular culture, shown in H5 and H10.

The selected headlines align with the user's interests in celebrity news, vintage cars, technology, health, and current events, making them the top 10 recommended news headlines.",0.6309297535714575,0.6309297535714575,0.5,"C1,C2"
